{
  "artifact_id": "artifact-7f3a9c20",
  "org_id": "org-acme",
  "project_id": "proj-iplanic",
  "run_id": "run-2026-06-11-001",
  "task_id": "TASK-001",
  "executor_id": "exec:hermes2zqf7kx3a4b5c6d",
  "artifact_type": "execution_log",
  "uri": "s3://iplanic-artifacts/org-acme/proj-iplanic/run-2026-06-11-001/execution_log.jsonl",
  "sha256": "e3b0c44298fc1c149afbf4c8996fb92427ae41e4649b934ca495991b7852b855",
  "media_type": "application/x-ndjson",
  "byte_size": 20481,
  "created_at": "2026-06-11T14:30:00Z"
}
